{
  "checkpoint": null,
  "last_applied_run": {
    "collection_since": "2024-02-01T00:00:00Z",
    "collection_until": "2024-03-01T00:00:00Z",
    "collector_version": "0.1.0",
    "command": "manual",
    "commit_history": null,
    "finished_at": "2024-03-02T12:05:00Z",
    "mode": "rebuild",
    "parent_discovery": null,
    "requested_end_month": "2024-02",
    "requested_start_month": "2024-02",
    "run_id": "0143c935-d9ef-5173-b585-a2bfe6987ca4",
    "started_at": "2024-03-02T12:00:00Z"
  },
  "reports": {
    "2024-02": "cf04c12581728d60ffbeac377fd7b6d244a104ccec04cbf08d4f2969cf36417c"
  },
  "repository": {
    "created_at": "2020-01-01T00:00:00Z",
    "full_name": "example/project",
    "history_start_established_by": null,
    "history_start_month": null,
    "node_id": "R_example",
    "url": "https://github.com/example/project"
  },
  "schema_version": "1"
}
